<?xml version="1.0" encoding="UTF-8" standalone="no"?>
<!--Copyright (C) 2012 ARM Limited. All rights reserved.-->
<flash_config
    xmlns:xi="http://www.w3.org/2001/XInclude"
    xmlns:xsi="http://www.w3.org/2001/XMLSchema-instance"
    xmlns="http://www.arm.com/flash_config"
    xsi:schemaLocation="http://www.arm.com/flash_config flash_config.xsd">
    <devices>
        <!-- The main flash device -->
        <device name="MainFlash">
            <programming_type type="FILE">
                <!-- Use the standard method for running Keil algorithms -->
                <method language="JYTHON" script="FDB://keil_flash.py" class="KeilFlash" method_config="Main"/>
                <!-- Target specific script to get target in a suitable state for programming -->
            </programming_type>
        </device>
    </devices>
    <method_configs>
        <!-- Parameters for programming the main flash -->
        <method_config id="Main">
            <params>
                <!-- Programming algorithm binary to load to target -->
                <param name="algorithm" type="string" value="FDB://algorithms/LPC_IAP_512.FLM"/>
                <!-- The core in the target to run the algorithm -->
                <param name="coreName" type="string" value="Cortex-M3"/>
                <!-- RAM location & size for algorithm code and write buffers -->
                <param name="ramAddress" type="integer" value="0x10000000"/>
                <param name="ramSize" type="integer" value="0x1000"/>
                <!-- Allow timeouts to be disabled -->
                <param name="disableTimeouts" type="string" value="false"/>
                        <param name="checkLPC17xx_Signature" type="string" value="true"/>
                <!-- Set to false to skip the verification stage -->
                <param name="verify" type="string" value="true"/>
            </params>
        </method_config>
    </method_configs>
</flash_config>
